smartctl 7.2 2020-12-30 r5155 [x86_64-linux-5.14.0-687.48.1.el9_8.x86_64] (local build)
Copyright (C) 2002-20, Bruce Allen, Christian Franke, www.smartmontools.org

=== START OF INFORMATION SECTION ===
Model Number:       Samsung SSD 970 EVO Plus 1TB
Serial Number:      S4GXNF0R876543
Firmware Version:   2B2QEXM7

=== START OF SMART DATA SECTION ===
SMART/Health Information (NVMe Log 0x02)
Critical Warning:                   0x00
Temperature:                        35 Celsius
Available Spare:                    100%
Available Spare Threshold:          10%
Percentage Used:                    0%
Data Units Read:                    12,345,678 [6.32 TB]
Data Units Written:                 9,876,543 [5.06 TB]
Power On Hours:                     8,760
Power Cycles:                       1,234
Unsafe Shutdowns:                   12
Media and Data Integrity Errors:    0
Error Information Log Entries:      0
