smartctl 7.2 2020-12-30 r5155 [x86_64-linux-5.14.0-687.48.1.el9_8.x86_64] (local build)
Copyright (C) 2002-20, Bruce Allen, Christian Franke, www.smartmontools.org

=== START OF INFORMATION SECTION ===
Model Family:     Samsung based SSDs
Device Model:     Samsung SSD 860 EVO 500GB
Serial Number:    S3Z2NB0K123456
Firmware Version: RVT04B6Q
User Capacity:    500,107,862,016 bytes [500 GB]
Sector Size:      512 bytes logical/physical

=== START OF READ SMART DATA SECTION ===
SMART Attributes Data Structure revision number: 16
Vendor Specific SMART Attributes with Thresholds:
ID# ATTRIBUTE_NAME          FLAG     VALUE WORST THRESH TYPE      UPDATED  WHEN_FAILED RAW_VALUE
  1 Raw_Read_Error_Rate     0x000f   119   099   006    Pre-fail  Always       -       201871234
  5 Reallocated_Sector_Ct   0x0033   100   100   036    Pre-fail  Always       -       0
  9 Power_On_Hours          0x0032   090   090   000    Old_age   Always       -       8760
194 Temperature_Celsius     0x0022   065   055   000    Old_age   Always       -       35
197 Current_Pending_Sector  0x0012   100   100   000    Old_age   Always       -       0
198 Offline_Uncorrectable   0x0010   100   100   000    Old_age   Offline      -       0
199 UDMA_CRC_Error_Count    0x0012   100   100   000    Old_age   Always       -       0
